{
  "normal": [
    1.0,
    0.0,
    0.0
  ],
  "normal_std_rad": 0.0005,
  "offset_m": 0.0,
  "offset_std_m": 0.003,
  "training_capture_ids": [
    "0",
    "1",
    "2",
    "3",
    "4",
    "5",
    "6",
    "7",
    "8",
    "9",
    "10",
    "11",
    "12",
    "13",
    "14",
    "15"
  ],
  "validation_capture_ids": [
    "16",
    "17",
    "18",
    "19"
  ]
}
